{
  "lag": 5.95,
  "trim": 0,
  "beatsPerMeasure": 8,
  "tracks": [
    { "title": "Vocals", "groups": ["Acapella"] },
    {
      "title": "Bongo &amp; Gu&iuml;ra",
      "groups": ["Percussion", "Instrumental"]
    },
    { "title": "Bass Guitar", "groups": ["Guitars", "Instrumental"] },
    {
      "title": "Lead &amp; Rhythm Guitars",
      "groups": ["Guitars", "Instrumental"]
    }
  ],
  "sections": [
    {
      "title": "Intro",
      "phrases": [
        [4],
        [{ "structure": "Derecho", "beats": 4, "offset": 4 }, 8, 8, 8]
      ]
    },
    {
      "title": "Verse",
      "structure": "Derecho",
      "phrases": [4]
    },
    {
      "title": "Mambo",
      "structure": "Derecho",
      "phrases": [2]
    },
    {
      "title": "Verse",
      "structure": "Derecho",
      "phrases": [4]
    },
    {
      "title": "Pre-Chorus",
      "structure": "Derecho",
      "phrases": [4]
    },
    {
      "title": "Chorus",
      "structure": "Majao",
      "phrases": [1, [8, 8, 8, 4]]
    },
    {
      "title": "Mambo",
      "phrases": [
        [
          "Derecho",
          4,
          { "structure": "Majao", "beats": 4, "offset": 4 },
          8,
          "Derecho",
          8,
          4
        ]
      ]
    },
    {
      "title": "Pre-Chorus",
      "structure": "Derecho",
      "phrases": [4]
    },
    {
      "title": "Chorus",
      "structure": "Majao",
      "phrases": [1, [8, 8, 8, 4]]
    },
    {
      "title": "Mambo",
      "structure": "Derecho",
      "phrases": [6]
    },
    {
      "title": "Bridge",
      "structure": "Derecho",
      "phrases": [2, 4]
    },
    {
      "title": "Mambo",
      "structure": "Derecho",
      "phrases": [[8, 4]]
    },
    {
      "title": "Chorus",
      "structure": "Majao",
      "phrases": [[8, 8, 8, 4], [2]]
    }
  ]
}
